{"$id":"QK_GBFP8_HEAD64_GRANULARITY_SWEEP_EXECUTION_V21_EXACTLY_ONCE_AUTHORITY_SCHEMA","$schema":"https://json-schema.org/draft/2020-12/schema","additionalProperties":false,"properties":{"action_id":{"const":"ace2:qk-gbfp8-base-v21:execute-once:289140ba:additive-0001"},"artifact_kind":{"const":"qk_gbfp8_head64_granularity_sweep_execution_v21_exactly_once_authority"},"authority_sha256":{"pattern":"^[0-9a-f]{64}$","type":"string"},"binding_record_count":{"const":25},"core_acceptance_file_sha256":{"const":"9e8eb7a1a7c4340ab8d7b70a2ee97a132169711659f0ca7608d6701ad3225761"},"core_manifest_file_sha256":{"const":"9e120e0e831ec736df45bd1b9f825217ce3368c5e22dbf3e4fc67ac537ea61f1"},"execution_package_file_sha256":{"pattern":"^[0-9a-f]{64}$","type":"string"},"fresh_l2_acceptance_sha256":{"pattern":"^[0-9a-f]{64}$","type":"string"},"interpreter_sha256":{"const":"fd4487ad3503b1aff61919108fd6f4f63c4245169fe9275f7c2ab76a1a53d3ad"},"invocation_sha256":{"pattern":"^[0-9a-f]{64}$","type":"string"},"launcher_invocation_sha256":{"pattern":"^[0-9a-f]{64}$","type":"string"},"numerical_tensor_names":{"const":["bf16.k_rope","bf16.q_rope","bf16.qk_scaled_scores"]},"official_identities":{"additionalProperties":false,"properties":{"input_tokens_sha256":{"pattern":"^[0-9a-f]{64}$","type":"string"},"lane_metadata_sha256":{"pattern":"^[0-9a-f]{64}$","type":"string"},"model_sha256":{"pattern":"^[0-9a-f]{64}$","type":"string"},"tensor_bundle_sha256":{"pattern":"^[0-9a-f]{64}$","type":"string"}},"required":["input_tokens_sha256","lane_metadata_sha256","model_sha256","tensor_bundle_sha256"],"type":"object"},"single_use":{"const":true},"state":{"const":"READY_UNCONSUMED"},"transport_attestation":{"additionalProperties":false,"properties":{"api":{"const":"os.posix_spawn"},"immediate_parent_argv_sha256":{"pattern":"^[0-9a-f]{64}$","type":"string"},"immediate_parent_environment_sha256":{"pattern":"^[0-9a-f]{64}$","type":"string"},"immediate_parent_executable_sha256":{"const":"fd4487ad3503b1aff61919108fd6f4f63c4245169fe9275f7c2ab76a1a53d3ad"},"immediate_parent_pid":{"minimum":1,"type":"integer"},"immediate_parent_transport_sha256":{"pattern":"^[0-9a-f]{64}$","type":"string"},"launcher_argv_sha256":{"pattern":"^[0-9a-f]{64}$","type":"string"},"launcher_environment_sha256":{"pattern":"^[0-9a-f]{64}$","type":"string"},"shell":{"const":false},"transport_attestation_sha256":{"pattern":"^[0-9a-f]{64}$","type":"string"}},"required":["api","immediate_parent_argv_sha256","immediate_parent_environment_sha256","immediate_parent_executable_sha256","immediate_parent_pid","immediate_parent_transport_sha256","launcher_argv_sha256","launcher_environment_sha256","shell","transport_attestation_sha256"],"type":"object"},"v18_acceptance_file_sha256":{"const":"342ab0130d7e132e4e288b9fa349f7e0c5efb87cb35f29cdbc86e3bc3f5e8cf2"},"v18_acceptance_self_sha256":{"const":"601980bd0a7af5040c1ad07c9ea88e6aad71619326574436175419637fe74e12"},"v18_action_id":{"const":"ace2:qk-gbfp8-base-v18:static-c02-binding-repair:additive-0001"},"v18_binding_table_file_sha256":{"const":"87ab3deb25f77d89b0797d72004b4436f9541987da13a42f44a2bff7f9fa9655"},"v18_manifest_file_sha256":{"const":"fdfc33a1443f237fbaca882b13fb977ae3c2ad7f61e427453297d0621f4445c8"},"v18_post_acceptance_report_self_sha256":{"const":"19d63c0b6610af00a9f031b7f91665496f0c17cdbfccb8cdc593d5a31ca0b3ae"}},"required":["action_id","artifact_kind","authority_sha256","core_acceptance_file_sha256","core_manifest_file_sha256","execution_package_file_sha256","fresh_l2_acceptance_sha256","interpreter_sha256","invocation_sha256","launcher_invocation_sha256","official_identities","single_use","state","transport_attestation","binding_record_count","numerical_tensor_names","v18_acceptance_file_sha256","v18_acceptance_self_sha256","v18_action_id","v18_binding_table_file_sha256","v18_manifest_file_sha256","v18_post_acceptance_report_self_sha256"],"type":"object"}
