{"action_id":"ace2:qk-gbfp8-base-v21:execute-once:289140ba:additive-0001","artifact_kind":"qk_gbfp8_head64_granularity_sweep_execution_v21_exactly_once_authority","authority_sha256":"ae1b1fe08aa58cdd5bbcb4cc8072e0d78a4121e0b87652123e52f045ae032902","binding_record_count":25,"core_acceptance_file_sha256":"9e8eb7a1a7c4340ab8d7b70a2ee97a132169711659f0ca7608d6701ad3225761","core_manifest_file_sha256":"9e120e0e831ec736df45bd1b9f825217ce3368c5e22dbf3e4fc67ac537ea61f1","execution_package_file_sha256":"45caa0015e55979dd6176a319792a3ae3a4da9f25a19baf9bec69b98de828d69","fresh_l2_acceptance_sha256":"19663777b84352691030325189ffb397b6386b5443200010cda0e6cd4a286c48","interpreter_sha256":"fd4487ad3503b1aff61919108fd6f4f63c4245169fe9275f7c2ab76a1a53d3ad","invocation_sha256":"132555e567d7c99402b19207de4eb178798497c0f0d5beaa746e1c1f1eae3784","launcher_invocation_sha256":"eeee67d88ac92fbdb9121d259abd4c5f0cff31fba8a049a69775a6384b7a5e20","numerical_tensor_names":["bf16.k_rope","bf16.q_rope","bf16.qk_scaled_scores"],"official_identities":{"input_tokens_sha256":"1b8c972381a2c3d7c754d1d2879b4389a13aca3f1d485f703510702c1cf2eb86","lane_metadata_sha256":"4d5904378b9ccbabd434119b6a57f8d4266abf3d8e772c4c1bca98df785e7f3a","model_sha256":"4a3c398aa381103aadf185da47b0631bce67539700e767eef588b761dc7827a7","tensor_bundle_sha256":"7cd2bbdbe611fdfce4d2cae66f6f20a43685087a35ce05c26c82d96749662175"},"single_use":true,"state":"READY_UNCONSUMED","transport_attestation":{"api":"os.posix_spawn","immediate_parent_argv_sha256":"2651316b53cc3e00230589ddf4020c107c5e510f8df9b1af55ed2746f79229ef","immediate_parent_environment_sha256":"056bcc009f734dec4c46d484b1769305200480c8428c4a3a5943038ea14d60d0","immediate_parent_executable_sha256":"fd4487ad3503b1aff61919108fd6f4f63c4245169fe9275f7c2ab76a1a53d3ad","immediate_parent_pid":1,"immediate_parent_transport_sha256":"71c8b84d6c44ce837fbfad0de24786d49e8044ad5d51dbd9fe184814645296fe","launcher_argv_sha256":"eeee67d88ac92fbdb9121d259abd4c5f0cff31fba8a049a69775a6384b7a5e20","launcher_environment_sha256":"b84a57af008c7b1eaecae3d1beb07a980b92d6b9b98c908f3b86a18a78fc12e4","shell":false,"transport_attestation_sha256":"e718faba087b24bd9a4d7d315b304f4d4c3274a1c006a571624c72c425d9a78a"},"v18_acceptance_file_sha256":"342ab0130d7e132e4e288b9fa349f7e0c5efb87cb35f29cdbc86e3bc3f5e8cf2","v18_acceptance_self_sha256":"601980bd0a7af5040c1ad07c9ea88e6aad71619326574436175419637fe74e12","v18_action_id":"ace2:qk-gbfp8-base-v18:static-c02-binding-repair:additive-0001","v18_binding_table_file_sha256":"87ab3deb25f77d89b0797d72004b4436f9541987da13a42f44a2bff7f9fa9655","v18_manifest_file_sha256":"fdfc33a1443f237fbaca882b13fb977ae3c2ad7f61e427453297d0621f4445c8","v18_post_acceptance_report_self_sha256":"19d63c0b6610af00a9f031b7f91665496f0c17cdbfccb8cdc593d5a31ca0b3ae"}
